{
  "addonId": "acme-enterprise-addon",
  "name": "Acme Enterprise Solution Addon",
  "organization": "Acme (ACME)",
  "version": "1.0.0",
  "description": "Demo enterprise addon showing the ground-rules, security guidelines, and VCS convention structure for a sample organization.",
  "targetArchetypes": ["tech-engineer"],
  "groundRules": [
    "보안 최우선 원칙: 외부 DB 접속 시 반드시 READONLY 계정을 별도 생성하여 설정할 것 (운영 DB 직접 수정 절대 금지)",
    "SSH 원격 명령 실행 시 파괴적 명령어(rm, drop, format 등)는 에이전트 단독 실행 금지 및 사용자 수동 승인 필수",
    "패키지 코드 수정 시 전체 리팩토링 지양, 하위 호환성을 보장하는 최소한의 수정 범위 준수",
    "사내 형상관리 규칙 및 VCS 4-Phase (이슈접수 → 명확화 → 개발제출 → MR리뷰/머지) 파이프라인 준수"
  ],
  "securityGuidelines": [
    "조직 팀 플랜 계정을 사용하여 대화 및 데이터가 모델 학습에 사용되지 않음을 확인",
    "개인정보(PII)나 비밀번호, API Secret이 포함된 로그는 마스킹 처리 후 에이전트에 전달"
  ],
  "vcs": {
    "type": "gitlab",
    "baseUrl": "https://gitlab.example.internal",
    "guidelinesRepo": "acme/vcs-usage-guidelines",
    "workflowPhases": [
      "Phase 1: issue-intake & issue-clarify",
      "Phase 2: repo-checkout & dev work",
      "Phase 3: dev-submit & mr-create",
      "Phase 4: mr-review-loop & auto-merge"
    ]
  },
  "mcpCatalog": [
    {
      "id": "db-readonly",
      "name": "사내 DB READONLY MCP",
      "type": "stdio",
      "command": "uv",
      "args": ["run", "src/server.py"],
      "safetyLevel": "readonly",
      "notes": "CREATE USER 'readonly'@'...' IDENTIFIED BY '...'; GRANT SELECT ON ... 권한 발급 필수"
    },
    {
      "id": "ssh-mcp",
      "name": "리눅스 서버 SSH MCP",
      "type": "stdio",
      "command": "npx",
      "args": ["-y", "ssh-mcp"],
      "safetyLevel": "requires_approval",
      "notes": "서버 로그 확인 및 서비스 런타임 진단 목적 (SSH Key 인증 권장)"
    }
  ],
  "recommendedPlugins": [
    "vcs-dev-workflow@acme-plugins",
    "vcs-workflow-guide@acme-plugins",
    "humanize-korean@im-not-ai",
    "hud@hud"
  ],
  "customQuestions": [
    "담당하시는 주력 솔루션/서비스가 무엇인가요?",
    "담당 서버의 OS 환경 및 사내 VCS 접속 토큰이 로컬에 설정되어 있나요?"
  ]
}
